{
  "id": "task-5-add-src-auth-personalprojectauthenticationadapter-js-for-strict-shop-sc-01eab5a5",
  "text": "Add `src/auth/PersonalProjectAuthenticationAdapter.js` for strict shop-scoped personal Project API authentication.",
  "goalId": "goal-b-implement-the-unified-apiease-project-cli-and-prepare-goal-c-bou-1c026fc0",
  "goal": "# Goal B — Implement the unified `apiease` Project CLI and prepare Goal C boundaries\n\n## Objective\n\nExtend the existing `apiease` npm package and executable with the project workflows finalized by the APIEase Apex Projects contracts, while preserving the compatible existing CLI commands.\n\nImplement one unified CLI for personal terminal use and future Apex Codex worker use. Do not create an Apex-specific CLI, duplicate command tree, serializer, candidate representation, retry implementation, result model, or Project API client.\n\nThis goal owns the CLI implementation. It must also record the APIEase application and contract work that Goal C must complete before approval-required worker apply and deferred secure-value workflows can operate end to end. Do not invent those missing server contracts inside the CLI.\n\n## Required working method\n\nBefore implementation, read and follow:\n\n- `AGENTS.md`\n- `.codex/AGENTS.md`\n- `../apiease/docs/apiease-cli-project-api-handoff.md`\n- `../apiease/docs/apex-projects.md`\n- `../apiease/backend/common/apexProjectsContract.js`\n- `../apiease/contracts/apex-projects/v1/apiease-project-contract.schema.json`\n- every fixture under `../apiease/contracts/apex-projects/v1/fixtures/`\n- the existing CLI architecture, tests, README, package exports, and release process\n- the current `../apiease-template` project where template behavior is relevant\n\nFollow the repository's mandatory TDD workflow. Run `.codex/run_test_suite.sh` before edits and after the complete change set. For each behavior change, add positive and negative targeted coverage, prove the targeted test fails before implementation, and then make it pass.\n\nThe APIEase schema, fixtures, constants, canonical bytes, outcomes, retry rules, and authority decisions are authoritative. Do not weaken, reinterpret, silently coerce, or independently redesign them. When a requirement in this statement needs a Goal C server-contract change, keep the CLI boundary focused and fail closed until the corresponding finalized APIEase schema and fixtures exist.\n\n## Existing behavior that must remain compatible\n\n- Keep the existing public executable named `apiease`.\n- Preserve compatible `create`, `read`, `update`, `delete`, `init`, `upgrade`, and `--version` behavior.\n- Preserve the existing regular `apiease init [project-name]` copy/materialization workflow. It may continue to use `../apiease-template` during local development and the existing installed-template materialization path in published usage.\n- Do not convert regular `apiease init` into a Git clone.\n- Treat `apiease init --from-existing-resources` as a distinct mode of the existing initializer.\n- Do not redesign `apiease upgrade` for Project API checkouts in this goal. Preserve its existing behavior for projects initialized through the existing template-manifest workflow. Assume an Apex worker will not invoke `apiease upgrade` in the initial integration.\n\n## Required Project API commands\n\nImplement:\n\n- `apiease init --from-existing-resources`\n- `apiease pull`\n- `apiease validate`\n- `apiease apply`\n\nThere is no candidate project-test endpoint and no `apiease test` command. Validation is non-executing. After committed apply, runtime behavior is verified by a person through established live APIEase execution paths.\n\n## Authentication and configuration\n\nProject API requests require both:\n\n- `x-apiease-api-key`\n- `x-shop-myshopify-domain`\n\nThe shop domain is a lookup selector. It grants no authority by itself. APIEase must normalize it and verify that the supplied API key belongs to that exact shop before deriving project, repository, and actor authority.\n\nIntroduce an interchangeable authentication-adapter interface used by the common Project API client and command implementations.\n\nImplement personal authentication with the two required headers. Reuse `ApiEaseHomeConfigurationResolver` and support explicit container-safe configuration with this precedence:\n\n1. command flags\n2. process environment variables\n3. the existing selected `~/.apiease` environment file\n\nSupport `APIEASE_API_KEY`, `APIEASE_BASE_URL`, and `APIEASE_SHOP_DOMAIN`. Keep diagnostics secret-safe. Do not print API keys or include them in JSON output.\n\nGoal B does not implement worker authentication. Worker authority remains fail-closed until Goal C supplies exact conversation-bound worker authentication and approval authority. Do not invent a worker header, unrestricted shared credential, capability format, or fallback from worker to personal authentication.\n\n## Initialization from existing resources\n\n`apiease init --from-existing-resources` must:\n\n1. Use the existing optional project-name convention while keeping `.` as the default destination.\n2. Require a new or empty destination suitable for cloning; do not merge a clone into an arbitrary populated directory.\n3. Perform a real Git clone of the fixed public `APIEase/apiease-template` repository at `main` for this mode.\n4. Preserve the clone as a normal Git checkout of the public template.\n5. Call `POST /api/v1/projects/bootstrap` with both personal authentication headers.\n6. Poll `PROJECT_BOOTSTRAP_PENDING` using the server-provided delay and the same logical request.\n7. Verify all contract versions, template identity, advertised limits, file counts, resource mappings, exact file digests, and the aggregate snapshot digest.\n8. Preserve the exact canonical bytes returned by APIEase.\n9. Publish the complete verified direct managed-file namespace only after all verification succeeds.\n10. Remove direct managed template sample files absent from the verified complete snapshot while preserving unmanaged template files and CLI intent/history directories.\n11. Resolve operational state with `git rev-parse --git-path apiease/project-state-v1.json`; never assume the Git directory is `.git`.\n12. Write returned local state only after the managed overlay succeeds.\n13. Report success only after the complete operation finishes.\n\nThe command must never request, expose, authenticate to, or clone APIEase's internally provisioned private customer repository.\n\n## Pull\n\n`apiease pull` must reuse the same bootstrap, polling, verification, digest, overlay, and state-publication services as initialization.\n\nIt must:\n\n- operate only in a valid initialized Project API checkout;\n- recompute the current direct managed namespace digest and detect edits relative to ignored local baseline state;\n- fail closed without changing files when local direct managed-file edits exist;\n- support an explicit `--force` option that deliberately discards those direct managed-file edits after showing or returning a bounded warning;\n- never automatically merge stale local and server source;\n- preserve unmanaged files, deletion intent files, and archived resource files;\n- replace operational state only after the verified managed publication succeeds;\n- leave old operational state unchanged and report a local-integrity failure if publication fails.\n\nDo not implement a multi-directory crash-recovery journal. Verify the complete artifact before publication, use safe individual file replacement where practical, write operational state last, and never report partial publication as successful. A local user can recover through Git; an ephemeral worker can discard the checkout and start again.\n\n## Local deletion and archive convention\n\nRepresent explicit deletion intent with a resource source file moved into the corresponding family delete directory:\n\n```text\nresources/functions/delete/<handle>.json\nresources/requests/delete/<handle>.json\nresources/variables/delete/<handle>.json\nresources/widgets/delete/<handle>.json\n```\n\nAfter a committed or replayed deletion, move the source file into the corresponding archive directory:\n\n```text\nresources/functions/archive/<handle>.json\nresources/requests/archive/<handle>.json\nresources/variables/archive/<handle>.json\nresources/widgets/archive/<handle>.json\n```\n\nDeletion and archive directories are source-controlled local workflow artifacts, not canonical Project API managed files. They must never be placed in `candidate.files`, included in the aggregate managed snapshot digest, overwritten by bootstrap/pull, or interpreted as live resources.\n\nCandidate construction must translate each valid delete file into an explicit, immutable-identity and resource-version-bound `candidate.deletions` entry using ignored local state. It must fail locally when:\n\n- the resource is not an existing bound resource;\n- the direct live source file and delete intent both exist;\n- the delete file's resource type or handle does not match its path;\n- duplicate or conflicting delete/archive intent exists;\n- required identity or expected-version authority is missing.\n\nMerely removing a direct working-tree resource file never means delete. Missing bound files without corresponding valid delete intent are local integrity failures.\n\nMove delete intent to archive only after `PROJECT_APPLIED`, `PROJECT_APPLY_NO_CHANGE` when applicable, or `PROJECT_APPLY_REPLAYED` proves the deletion was committed. Never archive on validation, planning, transport failure, conflict, or approval-pending outcomes.\n\n## Candidate construction\n\nBuild each candidate from the complete direct managed namespace, not merely changed files.\n\nRequired behavior includes:\n\n- strict canonical path and UTF-8 validation;\n- deterministic ordering of files and all contract arrays;\n- exact canonical byte validation;\n- exact file and aggregate digest calculation using the authoritative APIEase